author name,tokenized_sentence
Humayun Ahmed,মুখ দেখা যাওয়ার কোন কারণ নেই।
Humayun Ahmed,আয়না দেখলেই আমার কাছে দাঁড়াতে ইচ্ছা করে।
Humayun Ahmed,খুবই ক্ষুদ্র ইচ্ছা।
Humayun Ahmed,এবং নির্দোষ ইচ্ছা।
Humayun Ahmed,তবু অতি ক্ষুদ্র ইচ্ছাকে প্রশ্রয় দিতে নেই।
Humayun Ahmed,একবার প্রশ্রয় দেয়া শুরু করলে সব ইচ্ছাকেই প্রশ্রয় দিতে মন চাইবে।
Humayun Ahmed,যে মানব সন্তান ক্ষুদ্র কামনা জয় করতে পারে সে বৃহৎ কামনাও জয় করতে পারে।
Humayun Ahmed,এই মহৎ বাণী আমার বাবার।
Humayun Ahmed,চামড়ায় বাঁধানো তিনশ একুশ পৃষ্টার একটা খাতায় তিনি এইসব বাণী মুক্তার মত গোটা গোটা হরফে লিখে রেখে গেছেন।
Humayun Ahmed,পুরো খাতাটাই হয়তো ভরে ফেলার ইচ্ছা ছিল।
Humayun Ahmed,সময় পাননি।
Humayun Ahmed,মাত্র চার দিনের নোটিসে তাঁকে পৃথিবী ছাড়তে হল।
Humayun Ahmed,জ্বর হল।
Humayun Ahmed,জ্বরের চতুর্থ দিনে বিস্ময় এবং দুঃখ নিয়ে তাঁকে বিদায় নিতে হল।
Humayun Ahmed,"আমাকে হতাশ গলায় বললেন, আসল কথা তোকে কিছুই বলা হল না।"
Humayun AHmed,"মিসির আলির ধারণা ছিল, তিনি সহজে বিরক্ত হন না।"
Humayun AHmed,এই ধারণাটা আজ ভেঙে যেতে শুরু করেছে।
Humayun AHmed,ঠিক এই মুহূর্তে তিনি অসম্ভব বিরক্ত।
Humayun AHmed,"যে-রিকশায় তিনি উঠেছেন, তার সীটটা ঢালু।"
Humayun AHmed,বসে থাকা কষ্টের ব্যাপার।
Humayun AHmed,"তার চেয়েও বড় কথা, দু' মিনিট পরপর রিকশার চেইন পড়ে যাচ্ছে।"
Humayun AHmed,এখন বাজছে দশটা তেইশ।
Humayun AHmed,সাড়ে দশটায় থার্ড ইয়ার অনার্সের সঙ্গে তাঁর একটা টিউটরিআল আছে।
Humayun AHmed,এটা কোনোক্রমেই ধরা যাবে না।
Humayun AHmed,"যে হারে রিকশা এগুচ্ছে, তাতে ইউনিভার্সিটিতে পৌছতে তাঁর আরো পনের মিনিট লাগবে।"
Humayun AHmed,এ-কালের ছাত্ররা এতক্ষণ তাদের টীচারদের জন্যে অপেক্ষা করে না ।
Humayun AHmed,মিসির আলি তাঁর বিরক্তি ঢাকবার জন্যে একটা সিগারেট ধরালেন।
Humayun AHmed,ঠিক তখন পঞ্চম বারের মতো রিকশার চেইন পড়ে গেল।
Humayun AHmed,রিকশাওয়ালার ভাব-ভঙ্গি দেখে মনে হচ্ছে চেইন পড়ার ব্যাপারটায় সে আনন্দিত।
Humayun AHmed,গদাইলশকরী চালে সে নামল এবং সামনের চাকাটা তুলে ঝাঁকাঝাঁকি করতে লাগল !
Humayun AHmed,চেইন পড়ে গেলে কেউ চাকা তুলে ঝাঁকাঝাঁকি করে বলে তাঁর জানা ছিল না।
Humayun AHmed,"রুক্ষ গলায় বললেন, 'এ রকম করছ কেন?"
Humayun AHmed,রিকশাওয়ালা জবাব দিল না।
Humayun AHmed,গরম চোখে তাকাল এবং মিসির আলিকে সম্পূর্ণ উপেক্ষা করে একটা বিড়ি ধরাল।
Humayun AHmed,মিসির আলি রাগ সামলাবার চেষ্টা করতে লাগলেন।
Humayun AHmed,কুড়ি থেকে এক পর্যন্ত উল্টো দিকে গুনলেন।
Humayun AHmed,জীবনানন্দ দাশের 'মনে হয় একদিন' কবিতার প্রথম চার লাইন মৃদু স্বরে আওড়ালেন।
Humayun AHmed,"মিসির আলির ধারণা, কিছু কিছু কবিতা মানুষের অস্থিরতা কমিয়ে দেয়।"
Humayun AHmed,মনে হয় একদিন' এমন একটি কবিতা।
Humayun AHmed,কিন্তু আজ তাঁর রাগ কমছে না।
Humayun AHmed,"রিকশাওয়ালা কঠিন মুখ করে নির্বিকার ভঙ্গিতে, বিড়ি টানছে।"
Humayun AHmed,মিসির আলির দিকে ফিরেও তাকাচ্ছে না।
Humayun AHmed,"মিসির আলি নিজেকে সামলাবার জন্যেই ভাবতে লাগলেন—তিনি নিজে যদি

সিগারেট ধরাতে পারেন, তাহলে এই লোকটি পারবে না কেন?"
Humayun AHmed,জুন মাসের প্রচণ্ড গরমে বেচারা ক্লান্ত ও বিরক্ত।
Humayun AHmed,এক জন ক্লান্ত ও বিরক্ত মানুষের নিশ্চয়ই বিশ্রাম করার অধিকার আছে।
Humayun AHmed,"তিনি হালকা গলায় বললেন, 'নাম কি তোমার?"
Humayun AHmed,"সামসু, রিকশা চালাও।"
Humayun AHmed,ক্লাস মিস হবে।
Humayun AHmed,সামসু কোনো পাত্তাই দিল না।
Humayun AHmed,রাস্তার পাশে পেচ্ছাব করতে বসে গেল।
Humayun AHmed,"তার বসার ভঙ্গি থেকেই বোঝা যাচ্ছে সে সহজে উঠবে না, বসেই থাকবে।"
Humayun AHmed,এই লোকটি কি কোনো-একটি অজ্ঞাত কারণে তাঁর সঙ্গে ঝগড়া বাধাবার চেষ্টা করছে ?
Humayun AHmed,মিসির আলি রিকশা থেকে নেমে পড়লেন।
Humayun AHmed,"পাঁচ টাকা ভাড়া ঠিক করা ছিল, তিনি ছ’টাকা দিলেন।"
Humayun AHmed,"সহজ স্বরে বললেন, 'নাও, ভাড়া নাও।"
Humayun AHmed,আমি হেঁটে চলে যাব।
Humayun AHmed,সাধারণত রিকশাওয়ালাদের সবচেয়ে ময়লা ন্যাতন্যাতে নোটগুলো দেয়া হয়।
Humayun AHmed,মিসির আলি তাকে দিয়েছেন কচকচে নতুন নোট।
Humayun AHmed,"এটা তিনি করলেন এই আশায়, যাতে সামসু নামের এই উদ্ধত যুবকটি তাঁর আচরণের জন্যে লজ্জিত বোধ করে।"
Humayun AHmed,এ-রকম কাণ্ডকারখানা মিসির আলি সাহেব করে থাকেন।
Humayun AHmed,একবার বাসে তাঁর পাশে সুখী-সুখী চেহারার এক বুড়ো বসল।
Humayun AHmed,দু' জনের সীট।
Humayun AHmed,কিন্তু বুড়ো অকারণে পা ফাঁক করে তাঁকে চাপ দিতে লাগল।
Humayun AHmed,বিশ্রী কাণ্ড!
Humayun AHmed,"মিসির আলি খানিকক্ষণ চাপ সহ্য করলেন, তারপর উঠে দাঁড়িয়ে হাসিমুখে বললেন, 'আপনার বোধহয় অল্প জায়গায় বসার অভ্যেস নেই, আপনি বরং একাই এখানে আরাম করে বসুন।"
Humayun AHmed,"মিসির আলি ভেবেছিলেন, লোকটি এতে লজ্জিত ও বিব্রত হবে।"
Humayun AHmed,সে-রকম কিছু হল না।
Humayun AHmed,লোকটি নির্বিকার ভঙ্গিতে দু' জনের জায়গা দখল করে পা দোলাতে লাগল।
Humayun AHmed,এরা অসুখী মানুষ।
Humayun AHmed,নিজেদের ব্যক্তিগত যন্ত্রণা এরা--অন্যদের ওপর চাপিয়ে দিতে চেষ্টা করে।
Humayun AHmed,ঢাকা শহরে অসুখী মানুষের সংখ্যা এত দ্রুত বাড়ছে কেন ভাবতে ভাবতে মিসির আলি দ্রুত হাঁটতে লাগলেন।
Humayun AHmed,মাথার ওপর জুন মাসের গনগনে আকাশ।
Humayun AHmed,রাস্তাঘাট তেতে উঠেছে।
Humayun AHmed,বাতাসের লেশমাত্রও নেই।
Humayun AHmed,এ-বছর অসম্ভব গরম পড়েছে।
Humayun AHmed,এই অসহ্য গরমে রিকশাওয়ালারা মানুষ টানে কীভাবে কে জানে।
Humayun AHmed,মিসির আলি সামসু নামের উদ্ধত যুবকটির জন্যে এক ধরনের মায়া অনুভব করলেন।
Humayun AHmed,ক্লাস ফাঁকা।
Humayun AHmed,আসমানী রঙের জামদানি শাড়ি পরা একটি মেয়ে শুধু সেকেন্ড বেঞ্চে বসে আছে।
Humayun AHmed,মেয়েটির মাথায় ঘোমটা।
Humayun AHmed,এটা একটা নতুন ব্যাপার।
Humayun AHmed,ইউনিভার্সিটির মেয়েরা মাথায় ঘোমটা দেয় শুধু আজানের সময়।
Humayun AHmed,মিসির আলি ঢুকতেই মেয়েটি উঠে দাঁড়াল।
Humayun AHmed,"তিনি অপ্রস্তুত স্বরে বললেন, 'দেরি করে ফেললাম।"
Humayun AHmed,সবাই চলে গেছে নাকি?
Humayun AHmed,তুমি কেন ওদের সঙ্গে গেলে না?
Humayun AHmed,"মেয়েটি
মৃদু স্বরে বলল, 'স্যার, আপনি কি আমাকে চিনতে পারছেন না?"
Humayun AHmed,তোমার নাম নীলু।
Humayun AHmed,"আমি রুটিনে দেখেছি, আজ আপনার এখানে ক্লাস।"
Humayun AHmed,"মাথায় ঘোমটা, তাই বললাম।"
Humayun AHmed,নতুন বিয়ে হওয়া মেয়েরা প্রথম দিকে ঘোমটা পরে।
Humayun AHmed,আমি কি স্যার আপনার বাসায় যেতে পারি?
Humayun AHmed,‘বাসায় আমার কিছু ঝামেলা আছে।’
Humayun AHmed,"‘তাহলে স্যার, আপনি কি আমাদের বাসায় একটু আসবেন?’"
Humayun AHmed,আমার খুব দরকার।
Humayun AHmed,"ঠিক আছে, যাব।"
Humayun AHmed,‘আমাদের বাসার ঠিকানা কি আপনার মনে আছে?’
Humayun AHmed,এক বার গিয়েছিলেন আমাদের বাসায়।
Humayun AHmed,আমাদের বাসার দোতলায় আপনার এক জন পরিচিত মহিলা থাকতেন।
Humayun AHmed,রানু নাম।
Humayun AHmed,আমার খুব দরকার।
Humayun AHmed,মিসির আলি তাকিয়ে রইলেন মেয়েটার দিকে।
Humayun AHmed,"এই মেয়ের নাম নীলু, কিন্তু কোনো- এক বিচিত্র কারণে তাকে অবিকল রানুর মতো দেখাচ্ছে।"
Humayun AHmed,"স্যার, আপনি কি আজই যাবেন?"
Humayun AHmed,‘ঠিক আছে রানু।’
Humayun AHmed,‘আমার নাম কিন্তু স্যার নীলু।’
Humayun AHmed,"মিসির আলি লক্ষ করলেন, মেয়েটা হাসছে।"
Humayun AHmed,যেন তাকে রানু বলায় সে খুশি।
Humayun AHmed,এটাই যেন আশা করছিল।
Humayun AHmed,আমাদের বাসার ঠিকানা কি লিখে দেব?
Humayun AHmed,আমার মনে আছে।
Humayun AHmed,আসবেন কিন্তু স্যার।
Humayun AHmed,‘আসব।’
Humayun AHmed,আমি আসব।
Humayun AHmed,নীলু উঠে দাঁড়াল।
Humayun AHmed,এত সুন্দর মেয়েটি।
Humayun AHmed,শ্যামলা গায়ের রঙ।
Humayun AHmed,চোখে-মুখে তেমন কোনো বিশেষত্ব নেই।
Humayun AHmed,কিন্তু তবু এমন মায়া জাগিয়ে তুলছে কেন?
Humayun AHmed,মিসির আলি লজ্জিত বোধ করলেন।
Humayun AHmed,তাঁর বয়স একচল্লিশ।
Humayun AHmed,এই বয়সের এক জন মানুষের মনে এ- জাতীয় তরল ভাব থাকা উচিত নয়।
Humayun AHmed,তা ছাড়া এই মেয়েটি তাঁর ছাত্রী।
Humayun AHmed,মিসির আলি শূন্য ক্লাসে দীর্ঘ সময় বসে রইলেন।
Humayun AHmed,ভোরবেলায় মানুষের মেজাজ মোটামুটি ভালো থাকে।
Humayun AHmed,"বেলা বাড়ার সঙ্গে সঙ্গে খারাপ হতে থাকে, বিকালবেলায় মেজাজ সবচে বেশি খারাপ হয়, সন্ধ্যার পর আবার ভালো হতে থাকে।"
Humayun AHmed,এটাই সাধারণ নিয়ম।
Humayun AHmed,"এখন সকাল এগারটা, মেজাজের সাধারণ সূত্র মতে মিসির আলির মেজাজ ভালো থাকার কথা।"
Humayun AHmed,কিন্তু মিসির আলির মন এই মুহূর্তে যথেষ্টই খারাপ।
Humayun AHmed,তিনি বসার ঘরে বেতের চেয়ারে পা তুলে বসে আছেন।
Humayun AHmed,তাঁর ভুরু কুঁচকে আছে।
Humayun AHmed,তাঁর মেজাজ খারাপের দুটি কারণের প্রথমটা হল—একটা মাছি।
Humayun AHmed,অনেকক্ষণ থেকেই মাছিটা তাঁর গায়ে বসার চেষ্টা করছে।
Humayun AHmed,সাধারণ মাছি না—নীল রঙের স্বাস্থ্যবান ডুমো মাছি।
Humayun AHmed,আম-কাঁঠালের সময় এই মাছিগুলিকে দেখা যায়।
Humayun AHmed,এখন শীতকাল—এই মাছি এল কোত্থেকে?
Humayun AHmed,মাছিটা তার গায়েই বারবার বসতে চাচ্ছে কেন?
Humayun AHmed,তাঁর সামনে বসে থাকা মেয়েটির গায়ে কেন বসছে না?
Humayun AHmed,মিসির আলির মেজাজ খারাপের দ্বিতীয় কারণ এই মেয়েটি।
Humayun AHmed,তাঁর ইচ্ছা করছে মেয়েটিকে একটা ধমক দেন।
Humayun AHmed,যদিও ধমক দেবার মতো কোনো কারণ ঘটে নি।
Humayun AHmed,মেয়েটি তার সঙ্গে দেখা করতে এসেছে।
Humayun AHmed,দেখা করতে আসার অপরাধে কাউকে ধমক দেয়া যায় না।
Humayun AHmed,ধমক দেয়ার বদলে মিসির আলি শব্দ করে কাশলেন।
Humayun AHmed,"প্রচণ্ড শব্দে কাশলে, কিংবা কুৎসিত শব্দে নাক ঝাড়লে মনের রাগ অনেকখানি কমে।"
Humayun AHmed,মিসির আলির কমল না বরং আরো যেন বাড়ল।
Humayun AHmed,মাছিটাও মনে হচ্ছে এই শব্দে উৎসাহ পেয়েছে।
Humayun AHmed,এতক্ষণ গায়ে বসতে চাচ্ছিল এখন উড়ে ঠোটে বসতে চাচ্ছে।
Humayun AHmed,কী যন্ত্রণা!
Humayun AHmed,"স্যার, আমার নাম সায়রা বানু।"
Humayun AHmed,সায়রা বানু নামটা কি আপনার মনে থাকবে?
Humayun AHmed,"মিসির আলি বললেন, মনে থাকার প্রয়োজন কি আছে?"
Humayun AHmed,অবশ্যই আছে।
Humayun AHmed,"আমি এত আগ্রহ করে আমার নামটা আপনাকে কেন বলছি, যাতে মনে থাকে সেই জন্যেই তো বলছি।"
Humayun AHmed,"মিসির আলি রোবটের গলায় বললেন, মানুষের নাম আমার মনে থাকে না ।"
Humayun AHmed,"মেয়েটি তাঁর রোবট গলা অগ্রাহ্য করে হাসিমুখে বলল, আমারটা মনে থাকবে ।"
Humayun AHmed,কারণ একজন বিখ্যাত সিনেমা অভিনেত্রীর নাম সায়রা বানু।
Humayun AHmed,মিসির আলি ভুরু কুঁচকে তাকিয়ে আছেন।
Humayun AHmed,এখন তাঁর মাথার যন্ত্রণা শুরু হয়েছে।
Humayun AHmed,অর্থহীন কথা শুনতে ভালো লাগছে না।
Humayun AHmed,তা ছাড়া শীতও লাগছে।
Humayun AHmed,চেয়ারটা টেনে রোদে নিয়ে গেলে হয়।
Humayun AHmed,তাতে কিছুক্ষণ আরাম লাগবে তারপর আবার রোদে গা চিড়বিড় করতে থাকবে।
Humayun AHmed,শীতকালের এই এক যন্ত্রণা।
Humayun AHmed,ছায়া বা রোদ কোনোটাই ভালো লাগে না।
Humayun AHmed,মিসির আলি মাছিটার দিকে তাকিয়ে রইলেন।
Humayun AHmed,মাছিটার কারণে নিজেকে এখন কাঁঠাল মনে হচ্ছে।
Humayun AHmed,"মেয়েটি খানিকটা মাথা ঝুঁকিয়ে বলল, আপনি দিলীপ কুমার, সায়রা বানু এদের নাম শোনেন নি?"
Humayun AHmed,দিলীপ কুমারের নাম শুনেছি।
Humayun AHmed,সায়রা বানু হচ্ছে দিলীপ কুমারের বউ।
Humayun AHmed,"আমার বন্ধুরা অবিশ্যি আমাকে সায়রা বানু ডাকে না, তারা ডাকে এস বি।"
Humayun AHmed,"সায়রার এস, বানুর বি―এস বি।"
Humayun AHmed,এস বি-তে আর কী হয় বলুন তো?
Humayun AHmed,বলতে পারছি না।
Humayun AHmed,এস বি হচ্ছে স্পেশাল ব্রাঞ্চ।
Humayun AHmed,আমার বন্ধুদের ধারণা আমার চেহারায় একটা স্পাই স্পাই ভাব আছে।
Humayun AHmed,এই জন্যেই তারা আমাকে এস বি ডাকে।
Humayun AHmed,আচ্ছা আপনারও কি ধারণা আমার চেহারায় স্পাই স্পাই ভাব?
Humayun AHmed,ভালো করে একটু আমার দিকে তাকান না।
Humayun AHmed,আপনি সারাক্ষণ এদিক-ওদিক তাকাচ্ছেন কেন?
Humayun AHmed,মিসির আলি এদিক-ওদিক তাকাচ্ছেন না।
Humayun AHmed,মাছিটার দিকে তাকিয়ে আছেন।
Humayun AHmed,মাছিটা এদিক-ওদিক করছে বলেই এদিক-ওদিক তাকাতে হচ্ছে।
Humayun AHmed,আচ্ছা পৃথিবীতে মোট কত প্রজাতির মাছি আছে?
Humayun AHmed,এই যে শুনুন।
Humayun AHmed,তাকান আমার দিকে।
Humayun AHmed,মিসির আলি মেয়েটির দিকে তাকালেন।
Humayun AHmed,অতিরিক্ত ফর্সা একটি মেয়ে।
Humayun AHmed,বাঙালি মেয়েদের গায়ের রঙের একটা মাত্রা আছে।
Humayun AHmed,কোনো মেয়ে যদি সেই মাত্রা অতিক্রম করে যায় তখন আর ভালো লাগে না।
Humayun AHmed,তার মধ্যে বিদেশী বিদেশী ভাব চলে আসে।
Humayun AHmed,তাকে তখন আর আপন মনে হয় না।
Humayun AHmed,সায়রা বানুর ক্ষেত্রেও তাই হয়েছে।
Humayun AHmed,তাকে পর পর লাগছে।
Humayun AHmed,মেয়েটির মাথা ভরতি চুল।
Humayun AHmed,সেই চুলেও লালচে ভাব আছে।
Humayun AHmed,অতিরিক্ত ফর্সা মেয়েদের ক্ষেত্রে তাই হয়।
Humayun AHmed,তাদের গায়ের রঙের খানিকটা এসে চুলে লেগে যায়।
Humayun AHmed,চুল লালচে দেখায়—খানিকটা এসে লাগে চোখে।
Humayun AHmed,চোখ তখন আর কালো মনে হয় না ।
Humayun AHmed,মেয়েটির মুখ লম্বাটে।
Humayun AHmed,একটু বোঁচা ধরনের নাক।
Humayun AHmed,বোঁচা নাক থাকায় রক্ষা—বোঁচা নাকের কারণেই মেয়েটিকে বাঙালি মনে হচ্ছে।
Humayun AHmed,খাড়া নাক হলে মেডিটেরিনিয়ান সমুদ্রের পাশের গ্রিককন্যা বলে মনে হত।
Humayun AHmed,বয়স কত হবে?
Humayun AHmed,উনিশ থেকে পঁচিশের ভেতর।
Humayun AHmed,মানুষের বয়স চট করে ধরতে পারার কোনো পদ্ধতি থাকলে ভালো হত।
Humayun AHmed,গাছের রিং গুনে বয়স বলা যায়।
Humayun AHmed,মানুষের তেমন কিছু নেই।
Humayun AHmed,মানুষের বয়স তার মনে বলেই বোধ হয়।
Humayun AHmed,"আচ্ছা, একটা মাছি কতদিন বাঁচে?"
Humayun AHmed,স্যার কথা বলছেন না কেন?
