author name,tokenized_sentence
Humayun Ahmed,তীব্র এক অজানা ভয়ে মন অভিভূত হয়ে যাচ্ছে।
Humayun Ahmed,"নিজেকে সামলাবার জন্যে আমি দরজায় হাত রাখলাম, আর তখন ইরা বাথরুমে ঢুকে বাতি জ্বালাল।"
Humayun Ahmed,"ইরার হাতে সাবান, তোয়ালে।"
Humayun Ahmed,"সাবানটা নতুন, এখনো মোড়ক খোলা হয়নি।"
Humayun Ahmed,"আমি বললাম, কি হয়েছে ইরা ?"
Humayun Ahmed,"ইরা হাসতে হাসতে বলল, তোমার এত বুদ্ধি, তুমি এখনো বুঝতে পারছ না?"
Humayun Ahmed,না।
Humayun Ahmed,বুঝতে পারছি না।
Humayun Ahmed,অনুমান করতে পারছ ?
Humayun Ahmed,‘অনুমানও করতে পারছি না।’
Humayun Ahmed,"ইরা ঝলমলে গলায় বলল, আজ তোমার বিয়ে।"
Humayun Ahmed,রাত দশটার ট্রেনে বর আসবে।
Humayun Ahmed,রাতেই বিয়ে হবে।
Humayun Ahmed,কোন উৎসব-টুৎসব কিচ্ছু হবে না।
Humayun Ahmed,তোমাকে নিয়ে তারা ঢাকা চলে যাবে সকালের ট্রেনে।
Humayun Ahmed,আমি একদৃষ্টিতে ইরাকে দেখছি।
Humayun Ahmed,সে আজ তার সেই প্রিয় শাড়িটা পরেছে।
Humayun Ahmed,শাদা রঙের শিফন শাড়ি।
Humayun Ahmed,মা তাকে কখনো এই শাড়ি পরতে দেন না।
Humayun Ahmed,এই শাড়িতে তাকে না-কি বিধবার মত লাগে।
Humayun Ahmed,কিন্তু আমি আর ইরা শুধু জানি এই শাড়িতে তাকে কত সুন্দর লাগে।
Humayun Ahmed,ও বোধহয় ক্রমাগতই কাঁদছে।
Humayun Ahmed,ওর মুখ শুকনো।
Humayun Ahmed,চোখ ভেজা।
Humayun Ahmed,"সে হাসতে হাসতে কথা বলার চেষ্টা করছে, কিন্তু পারছে না।"
Humayun Ahmed,"ইরা বলল, সবাই খুব খুশি।"
Humayun Ahmed,সবচে' খুশি বাবা।
Humayun Ahmed,"আপা, তুমি মুখটা নিচু কর, আমি সাবান দিয়ে তোমার মুখ ধুইয়ে দেই।"
Humayun Ahmed,তোর মুখ ধুইয়ে দিতে হবে না।
Humayun Ahmed,তুই যা।
Humayun Ahmed,"ইরা বলল, আপা শোন বাবা যে সবচে' খুশি তা না।"
Humayun Ahmed,সবচে' খুশি হয়েছি আমি।
Humayun Ahmed,খবরটা শোনার পর থেকে আমি আনন্দে শুধু কাঁদছি ।
Humayun Ahmed,তুই এখন যা।
Humayun Ahmed,আমি হাত-মুখ ধুয়ে আসছি।
Humayun Ahmed,ইরা পুরোপুরি চলে গেল না।
Humayun Ahmed,বাথরুমের বাইরে দাঁড়িয়ে রইল।
Humayun Ahmed,আমি তাকালাম আয়নার দিকে।
Humayun Ahmed,আয়নায় কি সুন্দর দেখাচ্ছে আমাকে!
Humayun Ahmed,শান্ত সরল চেহারার একটা মেয়ের মুখ।
Humayun Ahmed,আয়নার মুখ কখনো হাত দিয়ে ছোঁয়া যায় না।
Humayun Ahmed,আমার প্রায়ই আয়নার মুখটাকে ছুঁতে ইচ্ছা করে।
Humayun Ahmed,আজও করছে।
Humayun Ahmed,আমি হাত দিয়ে সেই মুখ ছুঁতে গিয়ে আয়নায় সাবানের ফেনা লাগিয়ে ফেললাম।
Humayun Ahmed,আজ আমার বিয়ে।
Humayun Ahmed,আমার কেমন লাগছে ?
Humayun Ahmed,এখনো বুঝতে পারছি না।
Humayun Ahmed,আমার সমস্ত বোধ অসাড় হয়ে আছে।
Humayun Ahmed,তবে এক ধরনের শান্তি বোধ করছি।
Humayun Ahmed,"আমার একটা সমস্যা ছিল, ভয়াবহ ধরনের সমস্যা আজ হয়তো তা মিটে যাবে – এই শান্তি।"
Humayun Ahmed,বাথরুম থেকে বের হয়ে আমি সবার খুশি মুখ ধরনের হয়।
Humayun Ahmed,দেখব।
Humayun Ahmed,এ-ও তো কম না ।
Humayun Ahmed,আমার বিয়ে নিয়ে সবাই খুব সমস্যার মধ্যে পড়ে গিয়েছিল।
Humayun Ahmed,"সবাই ধরেই নিয়েছিল, আমার কোনদিন বিয়ে হবে না।"
Humayun Ahmed,এমন কোন দোয়া নেই যা মা আমার জন্যে পড়েন নি।
Humayun Ahmed,আজমীর শরীফ থেকে আনা লাল সূতা এখনো আমার গলায় ঝুলছে।
Humayun Ahmed,বিয়ে হয়ে যাবার পর এই সূতা খুলে ফেলতে হয় ।
Humayun Ahmed,যদি সত্যি সত্যি বিয়ে হয় তাহলে নিশ্চয় বাসর ঘরে ঢোকার আগে ইরা এসে কাঁচি দিয়ে সুতা কাটবে।
Humayun Ahmed,সুতা কাটতে গিয়ে হয়ত সে কিছুক্ষণ কাঁদবে।
Humayun Ahmed,ইরা খুব কাঁদতে পারে।
Humayun Ahmed,সত্যি কি আজ বিয়ে হবে?
Humayun Ahmed,কেন জানি এখনো বিশ্বাস হচ্ছে না।
Humayun Ahmed,স্বপ্ন দেখছি না তো?
Humayun Ahmed,গল্পের বই পড়তে পড়তে দুপুরে ঘুমিয়ে পড়েছিলাম।
Humayun Ahmed,হয়ত ঘুমের মধ্যেই স্বপ্ন দেখছি।
Humayun Ahmed,বিয়ের স্বপ্ন আমি প্রায়ই দেখি।
Humayun Ahmed,স্বপ্নের মধ্যেই একটা ঝামেলা হয়ে বিয়ে ভেঙ্গে যায়।
Humayun Ahmed,আমি দেখি একটা সুন্দর ছেলে আমার পাশে বসা।
Humayun Ahmed,এক সময় সে উঠে চলে যায়।
Humayun Ahmed,আমি চোখ ভর্তি জল নিয়ে জেগে উঠে খুব লজ্জিত হই।
Humayun Ahmed,বাস্তব কখনো স্বপ্নের মত নয়।
Humayun Ahmed,বাস্তব অন্যরকম।
Humayun Ahmed,বাস্তবে অনেক কথাবার্তার পর বিয়ে ঠিক হয়।
Humayun Ahmed,"আলাপ আলোচনা একটা পর্যায় পর্যন্ত যায়, তারপর তারা সুন্দর একটা চিঠি রেজিস্ট্রি করে পাঠায়
-
গভীর দুঃখ ও বেদনার সহিত আপনাকে জানাইতেছি যে, আমার মধ্যমপুত্র হঠাৎ বলিতেছে সে এক্ষণ বিবাহ করিবে না।"
Humayun Ahmed,আমি এবং তাহার মাতা তাহাকে বুঝানোর প্রাণপণ চেষ্টা করিয়া বিফল মনোরথ হইয়াছি।
Humayun Ahmed,তাহার সহিত আমাদের কিঞ্চিৎ মনোমালিন্যও হইয়াছে।
Humayun Ahmed,"যাহা হউক, আপাতত বিবাহ অনুষ্ঠান স্থগিত রাখা ভিন্ন কোন পথ দেখিতেছি না।"
Humayun Ahmed,পুত্র রাজি হইলে ইনশাআল্লাহ আবার ব্যবস্থা হইবে।
Humayun Ahmed,তবে আপনারা অপেক্ষা করিয়া থাকিবেন না।
Humayun Ahmed,যদি কোন ভাল পাত্রের সন্ধান পান কন্যার বিবাহ দিবেন।
Humayun Ahmed,আমাদের দোয়া থাকিবে ইহা জানিবেন।
Humayun Ahmed,শ্রেণীমত সকলকে সালাম ও দোয়া দিবেন ।
Humayun Ahmed,এইসব চিঠি সব সময় সাধু ভাষায় লেখা হয়।
Humayun Ahmed,হাতের লেখা হয় প্যাঁচানো চিঠির উপর আরবীতে লেখা থাকে ইয়া রব।
Humayun Ahmed,কেউ সাহস করে সত্য কথাটা লেখে না।
Humayun Ahmed,কেউ লেখে না - আপনার মেয়ে খুব সুন্দর।
Humayun Ahmed,আমাদের পছন্দ হয়েছে কিন্তু তার সম্পর্কে যে এত ভয়াবহ একটি গুজব আছে তা জানতাম না।
Humayun Ahmed,জানার পর বিয়ে নিয়ে এগুতে আমাদের সাহস হচ্ছে না।
Humayun Ahmed,আপনি আমাকে ক্ষমা করবেন।
Humayun Ahmed,"ইরা বাথরুমের দরজায় ধাক্কা দিয়ে বলল, আপা, এত দেরি করছ কেন?"
Humayun Ahmed,হাত- মুখ ধুতে এতক্ষণ লাগে ?
Humayun Ahmed,আমি জবাব দিলাম না।
Humayun Ahmed,আয়নায় নিজের দিকে তাকিয়ে মুগ্ধ হয়ে নিজেকে দেখছি।
Humayun Ahmed,আয়নার মানুষটার ভেতর মনে হয় প্রাণপ্রতিষ্ঠা হয়েছে।
Humayun Ahmed,সে আমাকে অনেক কথা বলতে চাচ্ছে।
Humayun Ahmed,এমন সব কথা যা আমি এই মুহূর্তে শুনতে চাই না ।
Humayun Ahmed,"আপা, তোমার চা ঠাণ্ডা হয়ে যাচ্ছে।"
Humayun Ahmed,আমি বের হয়ে এলাম।
Humayun Ahmed,"বাবা বললেন, নবু মা'কে বসার কিছু দাও না।"
Humayun Ahmed,ইরা ঘরের ভেতর থেকে মোড়া এনে দিল।
Humayun Ahmed,বাবার সামনের ছোট্ট সাইড টেবিলে দু'কাপ চা।
Humayun Ahmed,একটা প্লেটে কয়েকটা পাপড় ভাজা।
Humayun Ahmed,বাবা নিজেই একটা কাপ আমার হাতে দিলেন!
Humayun Ahmed,আমার লজ্জা লজ্জা লাগছে।
Humayun Ahmed,"তুলে
বাবা চায়ে চুমুক দিয়ে খুশি খুশি গলায় বললেন, চা ভাল হয়েছে।"
Humayun Ahmed,ভেরী গুড।
Humayun Ahmed,"কি রে নবু, চা ভাল হয়নি ?"
Humayun Ahmed,আমি হাসলাম।
Humayun Ahmed,"রান্নাঘর থেকে মা গলা বের করে বললেন, তোমরা ধীরে সুস্থে চা খাও – কুমড়া ফুলের বড়া ভাজছি।"
Humayun Ahmed,কুমড়া ফুলের বড়া আমার জন্যে ভাজা হচ্ছে।
Humayun Ahmed,আমাদের বাড়ির পেছনে কয়েকটা কুমড়ো গাছ ফুলে ফুলে ভর্তি হয়ে গেছে।
Humayun Ahmed,আমি কবে যেন কথায় কথায় বলেছিলাম কুমড়ো ফুলের বড়া করতো মা।
Humayun Ahmed,"মা বিরক্ত গলায় বলেছিলেন, সব ফুল খেয়ে ফেললে কুমড়ো আকাশ থেকে পড়বে?"
Humayun Ahmed,ইরা আমাদের সামনে দাঁড়িয়ে আছে।
Humayun Ahmed,"মা ইরার দিকে তাকিয়ে বিরক্ত গলায় বললেন, ইরা, তুই এখানে ঘুর ঘুর করছিস কেন?"
Humayun Ahmed,তোকে কি করতে বলেছি ?
Humayun Ahmed,অর্থাৎ মা ইরাকে সরিয়ে দিলেন।
Humayun Ahmed,বাবাকে সুযোগ করে দিলেন যেন তিনি আমার সঙ্গে একা কথা বলতে পারেন।
Humayun Ahmed,বুঝতে পারছি বাবা ছোটখাট একটা বক্তৃতা দেবেন।
Humayun Ahmed,এরকম বক্তৃতা তিনি আগেও কয়েকবার দিয়েছেন।
Humayun Ahmed,এইসব ঘরোয়া বক্তৃতার শুরুটা খুব নাটকীয় হয়।
Humayun Ahmed,বাবা এমন কিছু কথা দিয়ে বক্তৃতা শুরু করেন যার সঙ্গে মূল বক্তব্যের কোন সম্পর্ক নেই।
Humayun Ahmed,আজও সেই ব্যাপার হবে।
Humayun Ahmed,নবনী !
Humayun Ahmed,“জ্বি বাবা ।”
Humayun Ahmed,“জ্বি বাবা ।”
Humayun Ahmed,‘সক্রেটিসের একটা কথা আছে।’
Humayun Ahmed,খুবই গুরুত্বপূর্ণ কথা।
Humayun Ahmed,"সক্রেটিস বলেছেন, মানুষের একটাই সৎ গুণ, সেটা হচ্ছে তার জ্ঞান।"
Humayun Ahmed,আর মানুষের দোষও একটা।
Humayun Ahmed,"দোষ হল অজ্ঞানতা - Ignorance. পশুদের কোন গুণ নেই, কারণ তাদের জ্ঞান
নেই।"
Humayun Ahmed,বুঝতে পারছিস?
Humayun Ahmed,‘সক্রেটিসের এই বাণী মনে থাকলে জীবনটা সহজ হয়।’
Humayun Ahmed,জটিলতা কমে যায়।
Humayun Ahmed,ঠিক না মা?
Humayun Ahmed,আমি কিছুতেই বুঝতে পারছি না।
Humayun Ahmed,বাবা কি করে সক্রেটিস থেকে আমার বিয়ের ব্যাপারে আসবেন।
Humayun Ahmed,তিনি নিশ্চয়ই চিন্তা-ভাবনা করে রেখেছেন।
Humayun Ahmed,আমি বেশ আগ্রহ নিয়েই বাবার কথা শোনার জন্যে অপেক্ষা করছি।
Humayun Ahmed,"বাবা খুব গম্ভীর গলায় কলেজে লেকচার দেবার ভঙ্গিতে বললেন
-
‘বিয়ে নামক যে সামাজিক বিধি প্রচলিত আছে, তার মূল উদ্দেশ্য হল পূর্ণতা ।’"
Humayun Ahmed,একজন পুরুষ পূর্ণ হয় না যতক্ষণ না একজন সঙ্গিনী তার পাশে আসে।
Humayun Ahmed,এই জ্ঞান পশুদের নেই।
Humayun Ahmed,মানুষের আছে।
Humayun Ahmed,বুঝতে পারছিস ?
Humayun Ahmed,"‘বিবাহ পশুদের প্রয়োজন নেই, মানুষের প্রয়োজন, কারণ সক্রেটিসের ভাষায় মানুষ সৎগুণসম্পন্ন প্রাণী।’"
Humayun Ahmed,অর্থাৎ জ্ঞানী প্রাণী।
Humayun Ahmed,পরিষ্কার হয়েছে?
Humayun Ahmed,“জ্বি।”
Humayun Ahmed,“জ্বি।”
Humayun Ahmed,‘তোর বড় মামা খবর পাঠিয়েছেন।’
Humayun Ahmed,হাতে হাতে চিঠি পাঠিয়েছেন।
Humayun Ahmed,চিঠিটা পড়লেই তোর কাছে সব পরিস্কার হয়ে যাবে।
Humayun Ahmed,"মিনু, চিঠিটা দিয়ে যাও।"
Humayun Ahmed,মা সঙ্গে সঙ্গে চলে এলেন।
Humayun Ahmed,মা রান্নাঘরে চিঠি আঁচলে নিয়েই বসেছিলেন বলে মনে হয়।
Humayun Ahmed,তাঁর এক হাতে চিঠি।
Humayun Ahmed,অন্য হাতে প্লেট ভর্তি কুমড়ো ফুলের বড়া।
Humayun Ahmed,এই খাদ্যদ্রব্যটি আমার একার নয় বাবারও প্রিয়।
Humayun Ahmed,কোন বিশেষ আনন্দের ব্যাপার হলে ফুলের বড়া তৈরী হয়।
Humayun Ahmed,তখন শিশুদের মতই বাবার চোখ চক্‌চক্ করতে থাকে।
Humayun Ahmed,বাবা গভীর আগ্রহে বড়া খাচ্ছেন।
Humayun Ahmed,আমি চিঠি পড়ছি।
Humayun Ahmed,মামার হাতের লেখা ডাক্তারদের লেখার মত – অপাঠ্য।
Humayun Ahmed,এই চিঠি যেহেতু তিনি অনেক বেশি যত্ন নিয়ে লিখেছেন সেহেতু কিছুই পড়া যাচ্ছে না ।
Humayun Ahmed,আমি চিঠিতে চোখ বুলাচ্ছি।
Humayun Ahmed,মা আমার পাশে বসে আমার দিকে তাকিয়ে আছেন।
Humayun Ahmed,অনেকদিন পর মা'র পরনে ইস্ত্রী করা সুন্দর শাড়ি।
Humayun Ahmed,হাতে আজ দু'গাছা সোনার চুড়িও পরেছেন।
Humayun Ahmed,চুড়িতে সোনা সব ক্ষয়ে গেছে।
Humayun Ahmed,তামা বের হয়ে আছে।
Humayun Ahmed,তবু চুড়ি পরা হাতে মা'কে সুন্দর লাগছে।
Humayun Ahmed,মা'র হাত ভর্তি চুড়ি থাকলে বেশ হত।
Humayun Ahmed,যেখানে যেতেন রিনরিন করে হাতের চুড়ি বাজতো।
Humayun Ahmed,"দোয়াপর সমাচার,
-
তোমাদের একটি আনন্দ সংবাদ দিতেছি।"
Humayun Ahmed,পরম করুণাময়ের অশেষ কৃপায় ঢাকার পার্টির সংবাদ পাওয়া গিয়াছে।
Humayun Ahmed,তাহাদের নিকট হইতে খবর পাইয়া আমি ঢাকায় চলিয়া যাই এবং কথাবার্তা বলি।
Humayun Ahmed,তাহাদের সহিত অনেক বিষয় নিয়া বিস্তারিত আলাপ হইয়াছে।
Humayun Ahmed,আলোচনার ফলাফল নিম্নরূপ।
Humayun Ahmed,তাহারা নবনী মা'কে পছন্দ করিয়াছে।
Humayun Ahmed,ছেলে তাহার কিছু আত্মীয়স্বজন এবং বন্ধুবান্ধবসহ আগামী পরশু ১২ই আগস্ট রাতের ট্রেনে নেত্রকোনা পৌঁছিবে।
Humayun Ahmed,আল্লা চাহেত ঐ রাতেই শুভবিবাহ সুসম্পন্ন হইবে।
Humayun Ahmed,পরদিন প্রাতে তাহারা নববধূ নিয়া ঢাকা যাত্রা করিবে।
Humayun Ahmed,"আমি এই সংবাদ তোমাদের শেষ সময়ে দিতেছি, কারণ আমি চাহি না তোমরা এই সংবাদ নিয়া হৈ-চৈ শুরু কর ।"
Humayun Ahmed,"পাড়া প্রতিবেশী, নিকটজন, পরজন কেহই যেন কিছুই না জানে।"
Humayun Ahmed,"শুভকর্ম আগে সমাধা হোক, তখন সবাই জানিবে।"
Humayun Ahmed,দশজনের মত লোকের খাবার আয়োজন করিয়া রাখিবে।
Humayun Ahmed,মোজাম্মেল সাহেবকে বলিয়া তাঁহার জীপ গাড়িটি ইস্টিশনে রাখিবার ব্যবস্থা করিবে।
Humayun Ahmed,বিবাহ-সংক্রান্ত কোন আলাপ তাঁহার সঙ্গে করিবার প্রয়োজন নাই।
Humayun Ahmed,অসীম গোপনীয়তা কাম্য ।
Humayun Ahmed,বিবাহ পড়াইবার কাজী আমি সঙ্গে নিয়া আসিব।
Humayun Ahmed,বিবাহ রেজিস্ট্রি হইবে ময়মনসিংহ শহরে।
Humayun Ahmed,"খাওয়া-দাওয়ার আয়োজনের মধ্যে পোলাও, কোরমা, ঝাল গোশত, মুরগির রোস্ট রাখিবে।"
Humayun Ahmed,চিকন চালের সাদা ভাত যেন থাকে।
Humayun Ahmed,মুরব্বী কেহ থাকিলে সাদা ভাতই পছন্দ করিবেন।
Humayun Ahmed,আমি বড় মাছ নিয়া আসার চেষ্টা করিব।
Humayun Ahmed,মেছুনীকে বড় মাছের কথা বলিয়া রাখিয়াছি।
Humayun Ahmed,ভাত এবং পোলাও বরযাত্রী আসার পর রাঁধিবে।
Humayun Ahmed,দৈ-মিষ্টির ব্যবস্থা করার প্রয়োজন নাই ।
Humayun Ahmed,দৈ- মিষ্টি আমি সঙ্গে করিয়া নিয়া আসিব।
Humayun Ahmed,মুখ দেখার পর জামাইকে সেলামী হিসেবে এক হাজার টাকা দিলেই চলিবে।
Humayun Ahmed,আমি একটি স্বর্ণের আঙটি প্রস্তুত করাইয়া রাখিয়াছি।
Humayun Ahmed,স্যুটের কাপড় দিতে পারিলে ভাল হইত।
Humayun Ahmed,"আমি সন্ধানে আছি, ভাল কাপড় পাওয়া গেলে নিয়া আসিব।"
Humayun Ahmed,নবনীকে চোখে-চোখে রাখিবে।
Humayun Ahmed,যদিও জানি ইহার কোন প্রয়োজন নাই ।
Humayun Ahmed,তাহাকে ভালভাবে বুঝাইবে।
Humayun Ahmed,অতীত নিয়া সে যেন চিন্তা না করে।
Humayun Ahmed,গতস্য শোচনা নাস্তি।
Humayun Ahmed,আমি নিজেও তাহার সঙ্গে কিছু কথা বলিব।
Humayun Ahmed,গায়ে হলুদের একটা ব্যাপার আছে ইহা মোটেই গুরুত্বপূর্ণ নহে।
Humayun Ahmed,"গায়ে হলুদ হিন্দুয়ানী ব্যাপার, তবুও যেহেতু ইহা মেয়েদের একটা শখের ব্যাপার সেহেতু নিজেরা নিজেরা গায়ে-হুলদের ব্যবস্থা নিবে।"
Humayun Ahmed,কাহাকেও কিছু জানাইবার কোনই প্রয়োজন নাই।
Humayun Ahmed,আসল কথা গোপনীয়তা।
Humayun Ahmed,কেহ কিছু জানিবার আগেই কার্য সমাধা করিতে হইবে।
Humayun Ahmed,"আল্লাহ্ সহায় অসুবিধা
হইবে না ।"
