author name,tokenized_sentence
Humayun Ahmed,"ভূমিকা
আমাদের কালচারে অনুরোধে ঢেঁকি গেলার ব্যাপারটা আছে।"
Humayun Ahmed,লেখালেখি জীবনের শুরুতে প্রচুর ঢেঁকি গিলেছি।
Humayun Ahmed,শেষের দিকে এসে রাইস মিল গেলা শুরু করেছি।
Humayun Ahmed,হিমু এবং একটি রাশিয়ান পরী” তার উদাহরণ।
Humayun Ahmed,বৎসরে আমি একটাই হিমু লিখি ।
Humayun Ahmed,বিশ্বকাপ বাংলাদেশে হচ্ছে বলে দু'জন হিমু ।
Humayun Ahmed,একজন মাঠে বসে খেলা দেখবে অন্যজন পথে পথে হাঁটবে ।
Humayun Ahmed,"হুমায়ূন আহমেদ নুহাশপল্লী 

মাজেদা খালা গলা নামিয়ে, প্রায় ফিসফিস করে বললেন, পরী দেখবি?"
Humayun Ahmed,"আমি বললাম, কি রকম পরী?"
Humayun Ahmed,ডানাকাটা পরী ।
Humayun Ahmed,"আমি বললাম, ডানা কাটার ঘা শুকিয়েছে, না-কি ঘা এখনো আছে?"
Humayun Ahmed,"শরীরে ঘা নিয়ে ঘুরছে, এমন পরী দেখব না ।"
Humayun Ahmed,"মাজেদা খালা বিরক্ত মুখে বললেন, 'তুই কি সহজভাবে কোনো কথা বলতে পারিস না।"
Humayun Ahmed,ডানাকাটা পরী দেখতে চাস না-কি চাস না?
Humayun Ahmed,হ্যাঁ কিংবা না বল।
Humayun Ahmed,ডানাওয়ালা কিংবা ডানাকাটা কোনো ধরনের পরীই আমার দেখতে ইচ্ছা করছে না।
Humayun Ahmed,খালাকে খুশি করার জন্যে হ্যাঁ সূচক মাথা নাড়লাম ।
Humayun Ahmed,"খালা আমার সামনে 3R সাইজের একটা ছবি রেখে বললেন, এই দেখ ডানাকাটা পরী ।"
Humayun Ahmed,আমি দেখলাম গোঁফওয়ালা এক পরীর ছবি।
Humayun Ahmed,তার মাথার চুল ব্রাসের মত ছোট করে কাটা।
Humayun Ahmed,চাইনিজ কাটের হলুদ রঙের একটা সার্ট তার গায়ে।
Humayun Ahmed,সার্টের নিচে নীল রঙের হাফ পেন্ট।
Humayun Ahmed,পরীর হাতে টেনিস র‍্যাকেট।
Humayun Ahmed,কপালে ঘাম দেখে মনে হল টেনিস খেলে এসেছে।
Humayun Ahmed,"খালা বললেন, কেমন দেখলি?"
Humayun Ahmed,"আমি বললাম, ভাল ।"
Humayun Ahmed,গোঁফওয়ালা পরীর কথা আগে শুনি নি।
Humayun Ahmed,ছবি দেখে ভাল লাগল ।
Humayun Ahmed,ফ্রেঞ্চ কাট দাড়ি থাকলে আরো ভাল লাগতো ।
Humayun Ahmed,"খালা গলার স্বর আবারো খাদে নামিয়ে বললেন, ছেলে না, এ মেয়ে ।"
Humayun Ahmed,গোঁফ লাগিয়ে ছেলে সেজেছে।
Humayun Ahmed,তার আসল ছবি দেখলে মাথা ঘুরে সোফায় কাত হয়ে পড়ে যাবি ।
Humayun Ahmed,দশ মিনিট উঠতে পারবি না।
Humayun Ahmed,বুক ধড়ফড়ানি রোগ হয়ে যাবে।
Humayun Ahmed,এই দেখ আসল ছবি।
Humayun Ahmed,"এখন বল এই মেয়ে যদি পরী না হয় তাহলে পরী
কে?"
Humayun Ahmed,"আমি বললাম, হুঁ ।"
Humayun Ahmed,শুধু হুঁ বললি ।
Humayun Ahmed,সুন্দর একটা কথা বল।
Humayun Ahmed,"আমি বললাম, “কে বলে শারদ পপি এ যূখের তুলা পদনখে পড়ে আছে
তার কতগুলো ।”"
Humayun Ahmed,"আমি বললাম, “কে বলে শারদ পপি এ যূখের তুলা পদনখে পড়ে আছে
তার কতগুলো ।”"
Humayun Ahmed,এর মানে কি?
Humayun Ahmed,এর মানে হল শরৎ রাতের চাঁদও এই সুখের তুলনা হবে না।
Humayun Ahmed,শরতের পূর্ণ চন্দ্র পড়ে থাকবে এই তরুণীর পায়ের নখের কাছে।
Humayun Ahmed,বাহ্।
Humayun Ahmed,তুই বানিয়েছিস?
Humayun Ahmed,কবি ভারতচন্দ্র লিখেছেন।
Humayun Ahmed,উপবতী প্রায় দেখলে উনার মাথা ঠিক থাকত না।
Humayun Ahmed,নিজে বিয়ে করেছিলেন এর ভড়কা রাক্ষশীকে।
Humayun Ahmed,ধুমসি আলুর বস্তা।
Humayun Ahmed,গাত্র বর্ণ পাতিল কালো ।
Humayun Ahmed,দু'টা দাঁত খরগোসের স্নাত সব সময় ঠোঁটের বাইরে ।
Humayun Ahmed,ভারতবাবু এই মেয়েকে বিয়ে কখন কেন ?
Humayun Ahmed,মহিলার উচ্চবংশ বলে বিয়ে ধরেছিলেন কবিরা আবার বংশের দিকে দুর্বল।
Humayun Ahmed,রাক্ষুসীর কথা বাদ দে এলিক্স মেয়েটাকে বিয়ে করবি?
Humayun Ahmed,"ধান্দাবাজি না, এক কথায় জবাব দে।"
Humayun Ahmed,হ্যাঁ না-কি না!
Humayun Ahmed,পরীর নাম এলিতা?
Humayun Ahmed,হুঁ।
Humayun Ahmed,"বাবা-মা রাশিয়ান, এলিভা জন্মসূত্রে আমেরিকান।"
Humayun Ahmed,ফটোগ্রাফির উপর কোর্স করেছে।
Humayun Ahmed,বাংলাদেশে আসার দিন ছবি তুলতে।
Humayun Ahmed,নাম The Food . ঢাকায় আসবে ডিসেম্বরের শেষ সপ্তাহে তুই হবি তার গাইড।
Humayun Ahmed,"আমিতো ইংরেজিই জানি না
গাইড হব কি ভাবে?"
Humayun Ahmed,"খালা বললেন, ঐ মেয়ে টিচার রেখে বাংলা শিখে তারপর আসছে।"
Humayun Ahmed,ওরা যা করে সিরিয়াসলি করে।
Humayun Ahmed,তোর মত অকারণে রাস্তায় খালি পায়ে হাঁটে না।
Humayun Ahmed,বাংলাদেশে আসবে তাই বাংলা শিখেছে।
Humayun Ahmed,তার চায়না যাওয়ার প্রোগ্রাম থাকলে চায়নিজ শিখতো।
Humayun Ahmed,রশিয়ান ভাষা সে জানে ।
Humayun Ahmed,"আমি খালাকে থামিয়ে দিয়ে বললাম, স্যুট লাল টাই কোথায় পাব?"
Humayun Ahmed,"খালা বললেন, ড্রেস নিয়ে তোকে চিন্তা করতে হবে না।"
Humayun Ahmed,তোর খালুর স্যুট টাই আমি আলাদা করে রেখেছি।
Humayun Ahmed,মাপে হবে না।
Humayun Ahmed,একটু উনিশ বিশ হবে।
Humayun Ahmed,কারো চোখে পরবে না।
Humayun Ahmed,আমার সামনে পরতো দেখি।
Humayun Ahmed,টাই এর নট বাঁধতে পারিস?
Humayun Ahmed,না।
Humayun Ahmed,আমি বেঁধে দিচ্ছি।
Humayun Ahmed,শিখে নে ।
Humayun Ahmed,এখন পরতে হবে?
Humayun Ahmed,হ্যাঁ।
Humayun Ahmed,তোর খালু বাসায় ফেরার আগেই স্যুট টাই নিয়ে বিদায় হয়ে যা ।
Humayun Ahmed,এখন থেকে সারাক্ষণ স্যুট টাই পরে থাকবি।
Humayun Ahmed,নয়তো আসল দিনে ঝামেলায় পরবি গা কুটকুট করবে।
Humayun Ahmed,টাই গলায় ফাঁসের মত লাগবে ।
Humayun Ahmed,স্যুট টাই পরলাম।
Humayun Ahmed,"খালা বললেন, কোটটা সামান্য লুজফিটিং হয়েছে।"
Humayun Ahmed,এটাই ভাল ।
Humayun Ahmed,আজকাল লুজফিটিং-এর চল।
Humayun Ahmed,যা আয়নার সামনে দাঁড়িয়ে দেখ তোকে কি সুন্দর মানিয়েছে।
Humayun Ahmed,তোর চেহারা যে এত সুন্দর আগে খেয়াল করিনি ।
Humayun Ahmed,আমি আয়নার সামনে দাঁড়িয়ে দেখি-নকল হিমু।
Humayun Ahmed,আয়নার হিমুকে মনে হচ্ছে এই হিমু ব্রিফকেস নিয়ে ঘুরে।
Humayun Ahmed,"সে বিরাট ধান্দাবাজ, সন্ধ্যাবেলা ক্লাবে যায়, বোতল খায় ৷খালা বললেন, নিজেকে দেখেতো মুগ্ধ হয়ে গেছিস।"
Humayun Ahmed,"পুরুষ মানুষকে বেশিক্ষণ আয়নায় নিজেকে দেখতে হয় না, চরিত্র খারাপ হয় ।"
Humayun Ahmed,এখন জুতা পর ।
Humayun Ahmed,জুতা ফিট করে কি-না দেখি ৷অনেক চেষ্টা করেও জুতা পায়ে ঢুকানো গেল না।
Humayun Ahmed,"মোজাসহ, মোজা ছাড়া নানানভাবে চেষ্টা করা হল ।"
Humayun Ahmed,"খালা বললেন, টাকা দিচ্ছি একজোড়া জুতা কিনে নিবি।"
Humayun Ahmed,ব্ল্যাক সু কিনবি।
Humayun Ahmed,নিচে গাড়ি আছে।
Humayun Ahmed,গাড়ি নিয়ে তোর খালুর এই স্যান্ডেলটা পড়ে চলে যা।
Humayun Ahmed,জুতার দোকানে গাড়ি থেকে নামবি।
Humayun Ahmed,কিছুক্ষণ স্যান্ডেল পরা থাকলে কিছু হবে না ।
Humayun Ahmed,আমি গাড়ি এবং স্যান্ডেল ছাড়াই বের হলাম।
Humayun Ahmed,হিমুর কিছুটা আমার মধ্যে থাকুক ।
Humayun Ahmed,স্যুট টাইয়ের সঙ্গে খালি পা ।
Humayun Ahmed,ঢাকা শহর বদলে গেছে।
Humayun Ahmed,কিভাবে বদলেছে কতটুকু বদলেছে?
Humayun Ahmed,"আমি বললাম, ভাষাবিধ পণ্ডিত পরী বিয়ে করা বিপদজনক তারপর তুমি যখন বলছ বিয়ে করব।"
Humayun Ahmed,বিয়ে কি মেয়ে ঢাকায় পৌঁছার পরপরই হবে?
Humayun Ahmed,মেয়ে জানে যে আমাকে বিয়ে করছে?
Humayun Ahmed,মেয়ে কিছুই জানে না।
Humayun Ahmed,তুই সারাক্ষণ মেয়ের সঙ্গে থাকবি।
Humayun Ahmed,তোর উদ্ভট উদ্ভট কথাবার্তা শুনে মেয়ে তোর প্রেমে পড়ে যাবে।
Humayun Ahmed,প্রেম একটু গাঢ় হলেই আমি কাজি ডেকে বিয়ে দিয়ে দেব।
Humayun Ahmed,তুই মেয়ের হাত ধরে চলে যাবি আমেরিকা ৷ তোর একটা গতি হয়ে যাবে।
Humayun Ahmed,এখন বুঝেছিস আমার প্ল্যান ।
Humayun Ahmed,এই মেয়ের সঙ্গে তুমি জুটলে কি ভাবে?
Humayun Ahmed,ইন্টারনেটে।
Humayun Ahmed,এলিতা আমার ফেসবুক ফ্রেন্ড।
Humayun Ahmed,তার বয়স একুশ।
Humayun Ahmed,তার একটাই দুঃখ এখনো না-কি সে কোনো বুদ্ধিমান ছেলে দেখে নি।
Humayun Ahmed,তার কাছে পুরুষ মানেই গাধা ।
Humayun Ahmed,ছেলে সেজেছে কেন?
Humayun Ahmed,বাংলাদেশে আসবে এই জন্যে ছেলে সেজেছে।
Humayun Ahmed,ছেলে সেজেই আসবে।
Humayun Ahmed,যতদিন থাকবে ছেলে সেজে থাকবে ।
Humayun Ahmed,সে এক নিউজে শুনেছে গরিব দেশে শাদা চামড়ার মেয়ের একা যাওয়া মানেই গ্যং রেপড হওয়া ।
Humayun Ahmed,এলিতা ভেজিটেরিয়ান ।
Humayun Ahmed,সকালে কি নাস্তা খায় জানিস তিনটা কাঁচা ওকরা ।
Humayun Ahmed,ওকরা কি জিনিস?
Humayun Ahmed,ওকরা হল ঢ্যাস ।
Humayun Ahmed,দুপুরে কি খায়?
Humayun Ahmed,অর্ধেকটা কাঁচা লাউ?
Humayun Ahmed,হিমু ফাজলামি বন্ধ।
Humayun Ahmed,আমি এই মেয়েটার বিষয়ে সিরিয়াস।
Humayun Ahmed,আমি চাই তুইও সিরিয়াস হবি।
Humayun Ahmed,তোদের দু'জনের বিষয়টা মাথায় কিভাবে এসেছে জানিস?
Humayun Ahmed,স্বপ্নে পেয়েছ!
Humayun Ahmed,ও আল্লা!
Humayun Ahmed,সত্যিতো ।
Humayun Ahmed,কিভাবে বললি?
Humayun Ahmed,আসলেই স্বপ্নে পেয়েছি এলিতা যখন জানলো সে ঢাকায় আসছে তখনি স্বপ্নটা দেখলাম।
Humayun Ahmed,দুপুরে খাওয়া দাওয়া করে শুয়েছি।
Humayun Ahmed,হাতে গল্পের বই।
Humayun Ahmed,গল্প পড়তে পড়তে ঘুমিয়ে পড়েছি তখন স্বপ্নটা দেখলাম ।
Humayun Ahmed,একটা ঘোড়ার গাড়িতে করে তোরা দু'জন যাচ্ছিস।
Humayun Ahmed,পেছনে ব্যান্ডপার্টি।
Humayun Ahmed,তোর পরনে স্যুট টাই ।
Humayun Ahmed,এলিতার পাশে তোকে মোটেই বেমানান লাগছে না?
Humayun Ahmed,সুন্দর লাগছে।
Humayun Ahmed,এলিতা পড়েছে লাল জামদানি।
Humayun Ahmed,তোর গলার টাইটা লাল ।
Humayun Ahmed,ক) ঢাকা শহরের চলমান মানুষ এখন কেউ কারো দিকে তাকায় না।
Humayun Ahmed,আমি আধঘণ্টার উপর স্যুট পরে খালি পায়ে হাঁটছি কেউ বিষয়টা ধরতে পারছে না ।
Humayun Ahmed,কেউ আমার পায়ের দিকে তাকাচ্ছেই না ।
Humayun Ahmed,খ) ঢাকা শহরে মুচি সম্প্রদায় বলে এক সম্প্রদায় ছিল।
Humayun Ahmed,তারা প্রথমে তাকাতো পায়ের দিকে।
Humayun Ahmed,পায়ের জুতা স্যান্ডেলের অবস্থা দেখত।
Humayun Ahmed,তারপর তাকাতো মুখের দিকে ।
Humayun Ahmed,জুতা ওয়ান টাইম আইটেম হয়েছে বলে মুচি সম্প্রদায় বিলুপ্ত।
Humayun Ahmed,জুতার দিকে তাকিয়ে থাকার কেউ নেই ।
Humayun Ahmed,গ) ঢাকা শহরের মানুষের বিস্মিত হবার ক্ষমতা পুরোপুরি নষ্ট হয়ে গেছে।
Humayun Ahmed,দু'জন আমাকে আপাদমস্তক দেখেছে।
Humayun Ahmed,একজন দেখে হাই তুলল।
Humayun Ahmed,দ্বিতীয় জন পানের পিক ফেলে উদাস হয়ে গেল।
Humayun Ahmed,তবে শিশুদের মধ্যে বিস্মিত হবার ক্ষমতা কিছুটা এখনো আছে।
Humayun Ahmed,স্কুল ফেরত এক বালিকা অনেক ঝামেলা করে তার মা'র দৃষ্টি আমার খালি পায়ের দিকে ফেরাল।
Humayun Ahmed,বিড়বিড় করে কিছু বলল।
Humayun Ahmed,মা ধমক দিয়ে তাকে নিয়ে চলে যাচ্ছে।
Humayun Ahmed,বালিকা যাবে না।
Humayun Ahmed,কাজেই আমি এগিয়ে গেলাম।
Humayun Ahmed,"আন্তরিক ভঙ্গিতে বললাম, খুকি তোমার কি খবর?"
Humayun Ahmed,মেয়েটা সামাজিকতার ধার দিয়ে গেল না।
Humayun Ahmed,"অবাক হয়ে বলল, আপনার পায়ে জুতা নেই কেন?"
Humayun Ahmed,"আমি বললাম, আমি জুতা আবিষ্কারের আগের মানুষ বলে পায়ে জুতা নেই ।"
Humayun Ahmed,"মেয়ের মা তার হাত ধরে হ্যাঁচকা টান দিয়ে বললেন, তানিজা চলতো।"
Humayun Ahmed,"তানিজা বলল, খালি পায়ে হাঁটলে অসুখ হয় আমার টিচার বলেছেন।"
Humayun Ahmed,"আমি বললাম, তানিজা তাকিয়ে দেখ ঢাকা শহরের বেশির ভাগ ভিক্ষুক খালি পায়ে হাঁটে।"
Humayun Ahmed,এদের অসুখ হয় না ।
Humayun Ahmed,"মেয়ের মা আমার দিকে তাকিয়ে কঠিন গলায় বললেন, প্লীজ আমাদের বিরক্ত করবেন না।"
Humayun Ahmed,"আমি বললাম, বিরক্ত করছি না গল্প করছি।"
Humayun Ahmed,আপনি আমাকে দেখে ভয় পাচ্ছেন কেন?
Humayun Ahmed,আপনার কি ধারণা আপনার মেয়েকে আমি ছিনিয়ে নিয়ে যাব ।
Humayun Ahmed,সুরাইয়া অবাক হয়ে তার ছেলের দিকে তাকিয়ে আছে ।
Humayun Ahmed,ছেলের নাম ইমন।
Humayun Ahmed,বয়স পাঁচ বছর তিনমাস।
Humayun Ahmed,মাথা ভর্তি কোকড়ানো চুল ।
Humayun Ahmed,লম্বাটে ধরণের মুখ।
Humayun Ahmed,"মাঝে মাঝে সেই মুখ কোন এক বিচিত্র কারণে গোলগাল দেখায়, আজ দেখাচ্ছে।"
Humayun Ahmed,ইমন তার মায়ের বিস্মিত দৃষ্টির কারণ ধরতে পারছে না।
Humayun Ahmed,সে ভুরু কুঁচকে মায়ের দিকে তাকিয়ে আছে।
Humayun Ahmed,ভুরু কুঁচকানোর এই বদঅভ্যাস সে পেয়েছে তার বাবার কাছ থেকে ।
Humayun Ahmed,ইমনের বাবা হাসানুজ্জামান অতি তুচ্ছ কারণে ভুরু কুঁচকে ফেলেন।
Humayun Ahmed,সেই কুঁচকানো ভুরু সহজে মসৃন হয় না ।
Humayun Ahmed,"সুরাইয়া বলল, ইমন একটা কাজ কর।"
Humayun Ahmed,আমার শোবার ঘরে যাও।
Humayun Ahmed,ড্রেসিং টেবিলের আয়নাটার সামনে দাঁড়াও।
Humayun Ahmed,দাঁড়িয়ে সুন্দর করে হেসে আবার আমার কাছে চলে এসো ।
Humayun Ahmed,"ইমন বলল, কেন ?"
Humayun Ahmed,আমি যেতে বলছি এই জন্যে যাবে।
Humayun Ahmed,সব কিছুতে কেন কেন করবে না ।
Humayun Ahmed,"ইমন সরু গলায় বলল, সবকিছুতে কেন কেন করলে কি হয় ?"
Humayun Ahmed,"সুরাইয়া বিরক্ত গলায় বলল, খুব খারাপ হয়।"
Humayun Ahmed,বড়রা কোন কথা বললে কেন কেন না বলে সেই কথা শুনতে হয়।
Humayun Ahmed,তোমাকে আয়নার সামনে যেতে বলছি তুমি যাও।
Humayun Ahmed,আয়নার সামনে দাঁড়িয়ে খুব সুন্দর করে হসিবে।
Humayun Ahmed,"মনে থাকে
যেন ।"
Humayun Ahmed,হাসলে কি হবে ?
Humayun Ahmed,‘হাসলে খুব মজার একটা ব্যাপার হবে।’
Humayun Ahmed,ইমন আয়নার দিকে যাচ্ছে।
Humayun Ahmed,খুব যে আগ্রহের সঙ্গে যাচ্ছে তা না।
Humayun Ahmed,আয়নার সামনে দাঁড়িয়ে হাসলে মজার কিছু হবে বলে তার মনে হচ্ছে না।
Humayun Ahmed,বড়রা যে প্রায়ই অর্থহীন কথা বলে এই সত্য সে ধরতে শুরু করেছে।
Humayun Ahmed,ইমন আয়নার সামনে গেল ।
Humayun Ahmed,ঠোঁট টিপে ভুরু কুঁচকে নিজের দিকে তাকিয়ে রইল।
Humayun Ahmed,মা হাসতে বলেছেন।
Humayun Ahmed,না হাসলে মজার কিছু ঘটবে না।
Humayun Ahmed,কাজেই সে সামান্য হাসল ।
Humayun Ahmed,এত সামান্য যে ঠোঁট পর্যন্ত ফাঁক হল না।
Humayun Ahmed,মজার কিছু ঘটল না।
Humayun Ahmed,ঘটবে না তা সে জানতো।
Humayun Ahmed,বড়রা ছোটদের ভুলাবার জন্যে মিথ্যা কথাও বলে।
Humayun Ahmed,ইমন আয়নার সামনে থেকে সরে গেল।
Humayun Ahmed,রওনা হল তার দাদীর ঘরের দিকে।
Humayun Ahmed,মিথ্যা কথা বলায় মা'র কাছে তার এখন আর যেতে ইচ্ছা করছে না।
Humayun Ahmed,সে ঠিক করল মায়ের সামনে দিয়েই সে দাদীর ঘরে যাবে তবে মা'র দিকে ফিরে তাকাবে না।
Humayun Ahmed,শুধু শুধু আয়নার সামনে দাঁড় করানোয় মা'র উপর তার রাগ লাগছে।
Humayun Ahmed,সুরাইয়া মিথ্যা কথা বলে নি।
Humayun Ahmed,ইমন যদি আয়নার সামনে দাঁড়িয়ে হাসত তাহলে সত্যি মজার একটা ব্যাপার ঘটত।
